{
  "schema_version": 1,
  "artifact_id": "domainlease-r11-semantic-rule-registry-v1",
  "registry_epoch": 1,
  "status": "draft_pending_independent_review",
  "owner_role": "external_semantic_policy_authority",
  "compatible_policy": {"artifact_id": "domainlease-r11-semantic-policy-v1", "policy_epoch": 1},
  "rule_shape": {
    "candidate_may_change_rule_meaning": false,
    "candidate_supplies_only_typed_bindings": true,
    "proof_backend_may_change_rule_meaning": false,
    "external_review_selects_final_digest": true
  },
  "family_counts": {
    "SEM-AUTH": 8,
    "SEM-RES": 8,
    "SEM-TRUST": 4,
    "SEM-WRITE": 7,
    "SEM-REV": 8,
    "SEM-ASYNC": 7,
    "SEM-ENTRY": 9,
    "SEM-SET": 8,
    "SEM-PROV": 8,
    "SEM-CROSS": 6
  },
  "rules": [
    {"id":"SEM-AUTH-001","normative_kind":"safety","applies_to":["AuthorityObject","AuthorityAccount"],"typed_parameters":["AuthorityID","AuthorityGeneration"],"canonical_template":"authority_object_account_atomic_visibility","policy_pointers":["/authority_kinds","/identity_policy"],"candidate_binding_schema":"BIND-AUTH-OBJECT-ACCOUNT","generated_obligation_ids":["INV-WELL-FORMED-BOUNDED"],"required_witnesses":["W1"],"required_mutation_ids":["MUT-POL-UNSAFE-REUSE"],"claim_ids":["POL-R11-AUTHORITY-CONSERVATION"]},
    {"id":"SEM-AUTH-002","normative_kind":"conservation","applies_to":["AuthorityIssue","ResourceVector"],"typed_parameters":["ParentAuthority","ChildAuthority","TransferVector"],"canonical_template":"issue_moves_quota_without_copy","policy_pointers":["/resource_algebra/issue_policy"],"candidate_binding_schema":"BIND-AUTH-ISSUE","generated_obligation_ids":["INV-RESOURCE-VECTOR-CONSERVATION"],"required_witnesses":["W1"],"required_mutation_ids":["MUT-POL-ISSUE-COPIES"],"claim_ids":["POL-R11-AUTHORITY-CONSERVATION"]},
    {"id":"SEM-AUTH-003","normative_kind":"conservation","applies_to":["Delegation","AuthorityConstraints"],"typed_parameters":["ParentRights","ChildRights","ParentConstraints","ChildConstraints","ParentHorizon","ChildHorizon"],"canonical_template":"componentwise_attenuation","policy_pointers":["/authority_separation_rules"],"candidate_binding_schema":"BIND-AUTH-ATTENUATION","generated_obligation_ids":["INV-AUTHORITY-ATTENUATION"],"required_witnesses":["W1"],"required_mutation_ids":["MUT-POL-AUTHORITY-FUSION"],"claim_ids":["POL-R11-AUTHORITY-CONSERVATION"]},
    {"id":"SEM-AUTH-004","normative_kind":"safety","applies_to":["AuthorityKind"],"typed_parameters":["ExecutionGrant","BudgetContext","SchedControl","ThreadControl","SpawnGrant","EndpointGrant","IssueGrant"],"canonical_template":"authority_role_nonimplication","policy_pointers":["/authority_kinds","/authority_separation_rules"],"candidate_binding_schema":"BIND-AUTH-ROLE","generated_obligation_ids":["INV-NO-AMBIENT-ACTIVATION"],"required_witnesses":["W0","W2","W4"],"required_mutation_ids":["MUT-POL-AUTHORITY-FUSION"],"claim_ids":["POL-R11-NO-AMBIENT-EXECUTION"]},
    {"id":"SEM-AUTH-005","normative_kind":"conservation","applies_to":["AuthorityRoleUse"],"typed_parameters":["AuthorityID","AuthorityGeneration","RoleKind","UseOrdinal"],"canonical_template":"one_fresh_role_ordinal_one_terminal","policy_pointers":["/async_policy","/resource_algebra"],"candidate_binding_schema":"BIND-AUTH-ROLE-USE","generated_obligation_ids":["INV-ASYNC-ROLE-USE-CONSERVATION"],"required_witnesses":["W2","W3"],"required_mutation_ids":["MUT-POL-ASYNC-ONE-USE-ALIAS"],"claim_ids":["POL-R11-ASYNC-PROVENANCE"]},
    {"id":"SEM-AUTH-006","normative_kind":"safety","applies_to":["SubjectLifecycle"],"typed_parameters":["SubjectID","SubjectGeneration","ProcessGeneration","Allowlist"],"canonical_template":"fork_exec_exit_no_ambient_authority","policy_pointers":["/authority_separation_rules"],"candidate_binding_schema":"BIND-SUBJECT-LIFECYCLE","generated_obligation_ids":["INV-NO-AMBIENT-ACTIVATION","INV-IDENTITY-GENERATION-NONALIAS"],"required_witnesses":["W0","W4"],"required_mutation_ids":["MUT-POL-AUTHORITY-FUSION"],"claim_ids":["EXEC-001","ASYNC-001"]},
    {"id":"SEM-AUTH-007","normative_kind":"protocol","applies_to":["CrossConsistencyDomainAuthorityMove"],"typed_parameters":["SourceCD","DestinationCD","ExportReceiptID","IdempotencyKey"],"canonical_template":"source_export_destination_idempotent_consume","policy_pointers":["/transaction_policy/cross_domain_protocol","/resource_algebra/disjoint_buckets"],"candidate_binding_schema":"BIND-CROSS-CD-EXPORT","generated_obligation_ids":["INV-RESOURCE-VECTOR-CONSERVATION"],"required_witnesses":["W1","W11"],"required_mutation_ids":["MUT-POL-RESOURCE-BUCKET-HOLE"],"claim_ids":["POL-R11-AUTHORITY-CONSERVATION","POL-R11-TRANSFER-NONDUPLICATION"]},
    {"id":"SEM-AUTH-008","normative_kind":"safety","applies_to":["AuthorityObject"],"typed_parameters":["Holder","Audience","AuthorityKind","Generation","Constraints","Horizon","RevocationPath","IssueOrdinal"],"canonical_template":"complete_holder_bound_authority_identity","policy_pointers":["/identity_policy","/authority_separation_rules"],"candidate_binding_schema":"BIND-AUTH-COMPLETE-IDENTITY","generated_obligation_ids":["INV-IDENTITY-GENERATION-NONALIAS","INV-AUTHORITY-ATTENUATION"],"required_witnesses":["W1","W12"],"required_mutation_ids":["MUT-POL-UNSAFE-REUSE"],"claim_ids":["POL-R11-AUTHORITY-CONSERVATION"]},

    {"id":"SEM-RES-001","normative_kind":"conservation","applies_to":["ResourceComponent"],"typed_parameters":["ResourceKind","Unit","NaturalBound"],"canonical_template":"typed_componentwise_natural_algebra","policy_pointers":["/resource_algebra/components"],"candidate_binding_schema":"BIND-RESOURCE-COMPONENT","generated_obligation_ids":["INV-RESOURCE-VECTOR-CONSERVATION"],"required_witnesses":["W1","W7"],"required_mutation_ids":["MUT-POL-RESOURCE-BUCKET-HOLE"],"claim_ids":["POL-R11-AUTHORITY-CONSERVATION","POL-R11-BOUNDED-CPU-USE"]},
    {"id":"SEM-RES-002","normative_kind":"conservation","applies_to":["ResourceAccount"],"typed_parameters":["Supply","BucketVector"],"canonical_template":"complete_pairwise_disjoint_bucket_partition","policy_pointers":["/resource_algebra/disjoint_buckets"],"candidate_binding_schema":"BIND-RESOURCE-BUCKETS","generated_obligation_ids":["INV-RESOURCE-VECTOR-CONSERVATION"],"required_witnesses":["W1","W3","W7","W11"],"required_mutation_ids":["MUT-POL-RESOURCE-BUCKET-HOLE"],"claim_ids":["POL-R11-AUTHORITY-CONSERVATION"]},
    {"id":"SEM-RES-003","normative_kind":"conservation","applies_to":["ResourceAccount"],"typed_parameters":["GenesisSupply","ImportedSupply","AllBuckets"],"canonical_template":"supply_equals_sum_of_all_buckets_per_component","policy_pointers":["/resource_algebra/conservation_equation"],"candidate_binding_schema":"BIND-RESOURCE-CONSERVATION","generated_obligation_ids":["INV-RESOURCE-VECTOR-CONSERVATION"],"required_witnesses":["W1","W7","W11"],"required_mutation_ids":["MUT-POL-ISSUE-COPIES"],"claim_ids":["POL-R11-AUTHORITY-CONSERVATION"]},
    {"id":"SEM-RES-004","normative_kind":"protocol","applies_to":["Refund","Burn"],"typed_parameters":["TerminalEvidence","ResourceVector","BurnReceipt"],"canonical_template":"refund_after_no_effect_or_named_audited_burn","policy_pointers":["/resource_algebra/burn_policy","/settlement_policy/refund_rule"],"candidate_binding_schema":"BIND-REFUND-BURN","generated_obligation_ids":["INV-ONE-RECEIPT-ONE-SETTLEMENT-ONE-APPLY"],"required_witnesses":["W1","W7"],"required_mutation_ids":["MUT-POL-RESOURCE-BUCKET-HOLE"],"claim_ids":["POL-R11-AUTHORITY-CONSERVATION"]},
    {"id":"SEM-RES-005","normative_kind":"safety","applies_to":["PhysicalOccurrence","RootCell"],"typed_parameters":["CPUIncarnation","FrameID","SlotID","OccurrenceID"],"canonical_template":"one_owner_per_physical_occurrence_and_root_cell","policy_pointers":["/physical_entry_policy","/resource_algebra/components"],"candidate_binding_schema":"BIND-PHYSICAL-OCCURRENCE","generated_obligation_ids":["INV-ONE-PHYSICAL-OWNER-PER-CPU","INV-ONE-ENTERED-ATTEMPT-PER-OCCURRENCE"],"required_witnesses":["W8","W9"],"required_mutation_ids":["MUT-POL-EXEC-WRITER"],"claim_ids":["POL-R11-PROVIDER-ROOTED-ENTRY"]},
    {"id":"SEM-RES-006","normative_kind":"noninterference","applies_to":["ProtectedWorkPartition"],"typed_parameters":["LaneID","WorkClass","ReservedUnits","RootAllocation"],"canonical_template":"lane_local_work_plus_shared_root_conservation","policy_pointers":["/resource_algebra/components","/progress_obligations"],"candidate_binding_schema":"BIND-PROTECTED-WORK-PARTITION","generated_obligation_ids":["INV-TWO-LANE-NO-DISJOINT-WAIT","PROG-DISJOINT-LANE"],"required_witnesses":["W9"],"required_mutation_ids":["MUT-POL-UNBOUNDED-WORK"],"claim_ids":["POL-R11-DISJOINT-PROGRESS"]},
    {"id":"SEM-RES-007","normative_kind":"conservation","applies_to":["InTransitAuthority"],"typed_parameters":["ExportReceiptID","ResourceVector","SourceGeneration","DestinationGeneration"],"canonical_template":"in_transit_supply_remains_counted_until_consume_or_refund","policy_pointers":["/transaction_policy/cross_domain_protocol","/resource_algebra/conservation_equation"],"candidate_binding_schema":"BIND-IN-TRANSIT","generated_obligation_ids":["INV-RESOURCE-VECTOR-CONSERVATION","INV-TRANSFER-SOURCE-DESTINATION-DISJOINT"],"required_witnesses":["W11"],"required_mutation_ids":["MUT-POL-RESOURCE-BUCKET-HOLE"],"claim_ids":["POL-R11-TRANSFER-NONDUPLICATION"]},
    {"id":"SEM-RES-008","normative_kind":"safety","applies_to":["FiniteNamespace","FiniteWork"],"typed_parameters":["Capacity","Demand","Generation","ParentEpoch"],"canonical_template":"overflow_reject_then_rekey_or_quarantine","policy_pointers":["/identity_policy/overflow_rule","/resource_algebra"],"candidate_binding_schema":"BIND-EXHAUSTION","generated_obligation_ids":["INV-WELL-FORMED-BOUNDED","INV-NO-RECLAIM-WITH-AUTHENTICATING-REFERENCE","PROG-GC-OR-QUARANTINE"],"required_witnesses":["W12"],"required_mutation_ids":["MUT-POL-UNBOUNDED-WORK"],"claim_ids":["POL-R11-SAFE-NAMESPACE-REUSE"]},